{
  "schemaVersion": "1.0.0",
  "caseId": "authorization-relationship-prisma",
  "outcome": "recommend",
  "allowedAlternativeOutcomes": [],
  "dispositions": [
    {
      "candidateId": "casbin",
      "disposition": "viable",
      "reasonCodes": ["embedded-policy-fit", "runtime-compatible"],
      "evidenceIds": ["auth-relationship-casbin"]
    },
    {
      "candidateId": "casl",
      "disposition": "viable",
      "reasonCodes": ["embedded-policy-fit", "runtime-compatible"],
      "evidenceIds": ["auth-relationship-casl"]
    },
    {
      "candidateId": "cerbos",
      "disposition": "viable",
      "reasonCodes": ["operational-overhead", "runtime-compatible"],
      "evidenceIds": ["auth-relationship-cerbos"]
    },
    {
      "candidateId": "openfga",
      "disposition": "recommended",
      "reasonCodes": [
        "operational-overhead",
        "relationship-model-fit",
        "runtime-compatible"
      ],
      "evidenceIds": ["auth-relationship-openfga"]
    }
  ],
  "rankGroups": [["openfga"], ["cerbos"], ["casbin", "casl"]],
  "rankRelations": [],
  "incomparablePairs": [],
  "hardConstraintConflicts": [],
  "requiredUnknownIds": ["relationship-migration-effort"],
  "requiredEvidenceIds": [
    "auth-relationship-casbin",
    "auth-relationship-casl",
    "auth-relationship-cerbos",
    "auth-relationship-openfga"
  ],
  "requiredReasonCodes": [
    "operational-overhead",
    "relationship-model-fit",
    "runtime-compatible"
  ],
  "rationaleNotes": [
    "OpenFGA is the proposed leader because the repository can operate its service and the request is explicitly relationship-shaped; CASL and Casbin remain plausible embedded alternatives."
  ],
  "evidenceCutoff": "2026-07-28",
  "provenance": {
    "status": "proposed",
    "authoringSession": "phase-2-issue-7-authoring-session",
    "independentReviewStatus": "not-reviewed",
    "independentReviewer": null,
    "reviewedAt": null
  }
}
